公司,职位,月薪,公司介绍,应聘要求,福利,职位关键词,上班地点
美创客互联,前端开发工程师,4k-6k・13薪,物联网 未融资 15-50人,经验1-3年 本科,“年轻团队、注重发展、”,前端开发 Vue Web前端 HTML5 ,[岳麓区]
维斯登,前端工程师,8k-12k,医疗丨健康 未融资 50-150人,经验3-5年 大专,“发展空间大”,前端开发 Web前端 ,[望城区]
爱员工,前端开发工程师,12k-24k,移动互联网 B轮 150-500人,经验3-5年 本科,"“牛人多,架构扁平,上升空间大”",Web前端 Vue Flutter Angular ,[麓谷]
数魔,前端工程师,10k-15k,"电商,数据服务 天使轮 50-150人",经验3-5年 本科,“双休、项目奖金、五险一金、舒适办公环境”,大数据 前端开发 Vue React jQuery ,[岳麓区]
凌志软件,前端开发工程师,10k-15k・13薪,金融 上市公司 2000人以上,经验3-5年 本科,“上市公司，年底双薪，国休不补班，周末双休”,移动端 Web前端 Vue ,[麓谷]
竞网,前端工程师,8k-14k,"移动互联网,电商 不需要融资 500-2000人",经验3-5年 大专,“五险一金、年终13-14薪”,前端开发 移动端 Web前端 CSS ,[岳麓区]
天创,前端开发工程师,14k-28k,"移动互联网,社交 不需要融资 50-150人",经验1-3年 本科,“五险一金 年底双薪 带薪休假 出国旅游”,社交 移动互联网 前端开发 Android IOS React native ,[坡子街]
土流网,Javascript 前端开发工程师,6k-10k,消费生活 C轮 150-500人,经验不限 本科,“公司平台大，晋升空间大”,前端开发 ,[涂家冲]
赢时胜软件,前端开发工程师,10k-15k,金融 上市公司 500-2000人,经验3-5年 本科,"“绩效奖金,年终奖金,股权激励”",前端开发 ,[伍家岭]
竹间智能科技(上海)有限公司,前端开发工程师,9k-12k,"移动互联网,其他 B轮 150-500人",经验1-3年 不限,“人工智能，弹性工作，福利好”,React jQuery Vue ,[岳麓区]
新贵族教育咨询,前端开发工程师,12k-13k,教育 未融资 少于15人,经验3-5年 本科,“良好的审美，好的待遇”,移动互联网 音乐 前端开发 ,[长沙县]
通铭教育,前端工程师,8k-10k,"企业服务,教育 上市公司 150-500人",经验1-3年 本科,“福利好、大牛云集”,Vue React Angular ,[岳麓区]
巧房科技,前端开发工程师,10k-15k・13薪,"移动互联网,企业服务 C轮 150-500人",经验1-3年 本科,“五险一金，周末双休，扁平管理”,前端开发 HTML Javascript CSS ,[咸嘉湖]
易观,前端开发工程师,10k-15k,"移动互联网,数据服务 B轮 150-500人",经验3-5年 本科,“技能培训、弹性工作、扁平管理、氛围融洽”,大数据 前端开发 HTML5 Vue Javascript ,[岳麓区]
校管家,前端开发工程师,12k-16k,"移动互联网,教育 A轮 150-500人",经验3-5年 本科,“六险一金、周末双休、节假日福利、员工体检”,前端开发 Web前端 Angular React ,[麓谷]
凯德技术,前端开发工程师,10k-15k,软件开发 未融资 150-500人,经验5-10年 大专,“福利待遇好，发展前景广阔”,前端开发 ,[开福区]
新数物联,前端开发工程师,6k-9k・13薪,"信息安全,软件开发 不需要融资 15-50人",经验1-3年 不限,“态势感知平台开发”,信息安全 前端开发 ,[天心区]
网信,前端开发工程师,10k-20k,"电商,企业服务 上市公司 500-2000人",经验5-10年 本科,“年底双薪，年终奖，饭补，公积金12%”,Web前端 ,[东屯渡]
腾云悦智,前端架构师,20k-30k,"企业服务,信息安全 不需要融资 500-2000人",经验5-10年 本科,“大牛带队，发展空间大”,前端开发 ,[岳麓区]
海典软件,中高级前端开发工程师,12k-20k・13薪,医疗丨健康 上市公司 150-500人,经验3-5年 本科,“B端产业互联网化大势所趋，想象空间巨大”,电商 医疗健康 Vue Node.js ES6 ,[岳麓区]
灵之心,web前端开发工程师,7k-10k,"教育,软件开发 未融资 15-50人",经验3-5年 不限,“前景佳 氛围好 福利齐全”,教育 前端开发 CSS ,[岳麓区]
聚之唯,Web前端工程师,8k-12k,软件开发、企业服务 天使轮 少于15人,经验3-5年 不限,“朝阳行业，年终奖，旅游，节日福利”,工具软件 ,[岳麓区]
诚毅软件,web前端开发工程师,7k-10k,企业服务 不需要融资 150-500人,经验不限 本科,“六险一金加班补贴专业培训年终奖带薪年假”,bootstrap Web前端 React native Vue ,[侯家塘]
同程旅行,h5前端开发工程师,15k-20k,旅游 上市公司 2000人以上,经验3-5年 不限,“上市公司”,前端开发 HTML5 ,[银盆岭]
长沙宏地科技开发有限公司,高级前端开发工程师,10k-15k,"金融,数据服务 不需要融资 50-150人",经验3-5年 本科,“入职五险一金 晋升机会多”,前端开发 Web前端 Vue Node.js ,[岳麓区]
海典软件,中高级前端开发工程师,10k-17k・13薪,医疗丨健康 上市公司 150-500人,经验3-5年 本科,“行业领先，医药电商，大牛团队，技术氛围好”,电商 医疗健康 移动端 前端开发 Web前端 Vue ,[望岳]
行云创新,web前端开发工程师,8k-16k,企业服务 A轮 50-150人,经验3-5年 本科,“技术型公司，周末双休，弹性考勤，福利好”,前端开发 HTML Vue ,[苏锦]
竞网,高级前端工程师,12k-16k,"移动互联网,电商 不需要融资 500-2000人",经验5-10年 大专,“13-14薪”,Node.js 移动端 前端开发 CSS ,[岳麓区]
绝味食品,高级前端开发工程师,10k-20k,"电商,广告营销 上市公司 2000人以上",经验5-10年 大专,“五险一金，双休，包中餐”,前端开发 Web前端 ,[火星]
天创,高级前端工程师,15k-30k,"移动互联网,社交 不需要融资 50-150人",经验3-5年 本科,"“五险一金,带薪年假,弹性工作”",移动端 Android IOS Web前端 ,[天心区]
北京水木信步,前端开发工程师,4k-5k,教育 天使轮 少于15人,经验应届毕业生 本科,“氛围简单 成长快”,前端开发 Javascript CSS ,[岳麓区]
土流网,web前端开发工程师,9k-14k,消费生活 C轮 150-500人,经验3-5年 本科,“C轮融资 双休 扁平化管理”,前端开发 HTML CSS ,[涂家冲]
知能科技,前端开发工程师,8k-16k,软件开发 不需要融资 15-50人,经验3-5年 本科,“六险一金，公司管饭，带薪休假，节日福利”,前端开发 ,[四方坪]
灵之心,web前端开发工程师,6k-10k,"教育,软件开发 未融资 15-50人",经验3-5年 本科,“氛围好 福利齐全”,,[岳麓区]
长城金融,web前端开发工程师,10k-15k,移动互联网 上市公司 500-2000人,经验3-5年 本科,"“朝阳行业,央企,五百强”",前端开发 ,[长沙县]
知能科技,前端工程师,6k-9k,软件开发 不需要融资 15-50人,经验1-3年 本科,“创业公司，大牛带队，五险一金，食堂管饭”,前端开发 ,[四方坪]
Anker,高级前端开发工程师,15k-25k,移动互联网 不需要融资 500-2000人,经验5-10年 本科,“薪酬福利好、发展空间大”,电商 移动互联网 前端开发 Web前端 Node.js ,[岳麓区]
智邦科冠,web前端工程师,10k-15k・13薪,"数据服务,软件开发 不需要融资 15-50人",经验3-5年 本科,“海外互联网项目，国际化产品”,Web前端 Vue React Node.js ,[左家塘]
长沙市云研网络科技有限公司,前端开发工程师,9k-12k,"移动互联网,消费生活 未融资 15-50人",经验3-5年 本科,“双休、五险、半年调薪一次的机会”,移动互联网 前端开发 Vue HTML5 CSS ,[天心区]
长沙宏地科技开发有限公司,中级前端开发工程师,8k-10k,"金融,数据服务 不需要融资 50-150人",经验1-3年 大专,“入职五险一金 晋升机会多”,前端开发 Web前端 Vue Node.js ,[岳麓区]
中国软件,web前端开发工程师,12k-18k,软件开发 上市公司 150-500人,经验5-10年 本科,“央企上市公司、具有竞争力的薪资福利”,信息安全 移动互联网 Vue Javascript ,[岳麓区]
十锐软件,高级前端开发工程师,7k-9k・13薪,软件开发 不需要融资 15-50人,经验3-5年 本科,“五险一金 双休 全勤奖”,Web前端 Vue React Android ,[四方坪]
青鱼互动,前端开发工程师,7k-12k,移动互联网 未融资 50-150人,经验1-3年 本科,“上升空间大；公司管理人性化”,HTML5 前端开发 HTML ,[天心区]
中一网络,web前端开发工程师,9k-15k,"社交,软件开发 不需要融资 50-150人",经验1-3年 本科,“五险一金，定期团建，年终奖”,社交 医疗健康 前端开发 移动端 React ,[芙蓉区]
爱传艺,前端开发工程师,7k-11k・13薪,教育 不需要融资 15-50人,经验1-3年 大专,“丰富工作经验，提升个人能力”,教育 前端开发 ,[岳麓区]
华锐金融技术,前端工程师(J10148),7k-12k,"移动互联网,金融 B轮 150-500人",经验应届毕业生 本科,“五险一金 加班补贴 有战斗力的团队”,Web前端 React Vue ,[岳麓区]
宝兰德软件,高级前端开发工程师,15k-25k,企业服务 上市公司 150-500人,经验5-10年 大专,“五险一金，年终奖，生日福利，职位晋级”,前端开发 Web前端 Vue ,[岳麓区]
特能博世科技,web前端开发工程师,8k-14k,"数据服务,其他 未融资 150-500人",经验3-5年 本科,“五险一金、绩效奖金、年终分红、带薪年假等”,前端开发 HTML5 Web前端 ,[天心区]
兔展RABBITPRE,前端开发工程师,8k-15k,移动互联网 B轮 150-500人,经验3-5年 本科,“技术氛围好 编码高效 大牛切磋”,前端开发 ,[岳麓区]
小村大优,前端开发工程师,9k-12k,消费生活 天使轮 少于15人,经验3-5年 本科,“每月100月餐补；五险一金；有年终奖”,本地生活 Javascript ,[开福区]
腾讯,22989-web前端开发工程师（腾讯云全资子公司,12k-20k,社交 上市公司 2000人以上,经验3-5年 本科,“平台大，发展快，待遇好，福利棒”,Web前端 Vue React native ,[岳麓区]
腾讯,36665-乘车码前端开发工程师（腾讯云全资子公司）,13k-26k・16薪,社交 上市公司 2000人以上,经验3-5年 本科,“大厂”,Node.js Javascript HTML5 ,[岳麓区]
树根互联技术有限公司,区块链web前端开发工程师,10k-20k,"移动互联网,企业服务 A轮 150-500人",经验3-5年 本科,“年终奖 领导nice 平台稳定”,前端开发 ,[长沙县]
优锘科技(uinnova),前端开发工程师,10k-20k・15薪,"移动互联网,企业服务 B轮 500-2000人",经验1-3年 本科,“可视化 ，大数据，机会多，团队牛，15薪”,前端开发 ,[岳麓区]
武汉光谷信息,前端开发工程师,8k-11k,企业服务 上市公司 500-2000人,经验3-5年 本科,“上市公司，六险一金，绩效奖金”,Web前端 Vue React Javascript ,[雨花区]
易观,前端开发工程师,10k-15k,"移动互联网,数据服务 B轮 150-500人",经验3-5年 本科,"“五险一金,双休,下午茶,会玩儿”",移动互联网 大数据 HTML5 Javascript Vue ,[麓谷]
长沙辰运软件有限公司,React.JS前端开发工程师,9k-13k・14薪,"移动互联网,企业服务 不需要融资 500-2000人",经验1-3年 本科,"“五险一金,超长带薪期,BAT同事,最前沿技术”",企业服务 ,[麓谷]
乐马科技,前端开发工程师,8k-10k,"金融,数据服务 不需要融资 50-150人",经验3-5年 本科,“周末双休”,HTML CSS 移动端 Web前端 ,[麓谷]
腾云悦智,前端架构师,20k-30k,"企业服务,信息安全 不需要融资 500-2000人",经验5-10年 本科,“骨干职位、发展前景、前沿技术”,云计算 大数据 Node.js Javascript Vue React ,[岳麓区]
彩云科技,前端开发工程师,6k-9k,"移动互联网,消费生活 不需要融资 15-50人",经验1-3年 本科,“行业前景大，年底分红”,本地生活 Vue Javascript CSS3 ,[井湾子]
政法频道,前端架构师,9k-12k,其他 不需要融资 150-500人,经验3-5年 大专,“13-14薪 入职购六险一金”,前端开发 React native Web前端 HTML5 ,[雨花区]
牛感科技,HTML5前端工程师,5k-8k,"物联网,区块链 天使轮 15-50人",经验应届毕业生 本科,“五险一金、双休”,大数据 移动互联网 ,[雨花区]
胜昊科技,前端开发工程师,7k-11k・13薪,其他 未融资 15-50人,经验3-5年 大专,“五险一金 双休 年底双薪，项目奖金”,Vue CSS HTML Javascript ,[开福区]
云畅科技,前端开发工程师（中/高级）,10k-15k,"消费生活,企业服务 不需要融资 50-150人",经验3-5年 大专,“五险一金、绩效奖金、弹性工作、股票期权”,前端开发 Web前端 HTML5 Javascript ,[雨花区]
奥森科技,前端架构师,15k-25k,移动互联网 未融资 15-50人,经验3-5年 本科,“五险一金 双休 年底双薪 弹性工作”,架构师 Node.js Vue ,[咸嘉湖]
海鹚科技,前端开发工程师,7k-12k,移动互联网 C轮 150-500人,经验1-3年 本科,“六险一金 年底双薪 双休”,React native HTML5 CSS ,[岳麓区]
五八到家有限公司,前端工程师,10k-20k,"消费生活,移动互联网 A轮 2000人以上",经验3-5年 本科,“给你一个施展技术的空间”,全栈 ,[岳麓区]
海鹚科技,前端开发工程师,7k-12k,移动互联网 C轮 150-500人,经验不限 本科,“六险一金 年底双薪 双休”,前端开发 HTML5 Javascript CSS ,[岳麓区]
美创客互联,前端开发工程师,9k-15k,物联网 未融资 15-50人,经验5-10年 大专,“注重职业发展、项目奖金”,前端开发 Vue HTML5 CSS ,[岳麓区]
文泉文化传媒,前端开发工程师,5k-10k,文娱丨内容 未融资 少于15人,经验1-3年 不限,"“Vue技术栈
可以远程开发”",HTML5 Vue Node.js 移动端 ,[开福区]
长沙紫檀数据科技有限公司,前端工程师,6k-10k,数据服务 不需要融资 15-50人,经验不限 不限,"“周末双休,薪酬待遇优,带薪年假”",大数据 金融 HTML5 bootstrap Vue Web前端 ,[望岳]
维斯登,前端工程师,5k-9k,医疗丨健康 未融资 50-150人,经验3-5年 大专,“五险一金餐补房补通讯补助员工旅游绩效奖金”,医疗健康 ,[望城区]
瀚正大数据研究院,前端开发工程师,8k-12k,"移动互联网,其他 A轮 50-150人",经验3-5年 大专,“入职缴五险一金享年假饭补交补通讯补年终奖”,React HTML TypeScript 前端开发 ,[岳麓区]
云链,前端开发工程师,10k-15k,企业服务 不需要融资 50-150人,经验3-5年 大专,“五险一金”,Vue React React native Angular ,[天心区]
三一,前端开发工程师,15k-30k,汽车丨出行 上市公司 2000人以上,经验3-5年 本科,“车联网，五险一金，大数据”,大数据 HTML5 Javascript Web前端 CSS ,[长沙县]
蔬东坡,前端开发工程师,8k-16k,"移动互联网,电商 A轮 50-150人",经验3-5年 大专,“广阔的上升空间，扁平化的管理风格”,工具软件 移动互联网 Angularjs 前端开发 Javascript ,[黄土岭]
好学区,前端开发工程师,8k-12k,"教育,移动互联网 未融资 15-50人",经验3-5年 本科,“双休+五险+公司福利+年终奖”,教育 工具软件 前端开发 Vue HTML5 Javascript ,[岳麓区]
云领,前端开发工程师,10k-16k,"移动互联网,信息安全 不需要融资 500-2000人",经验5-10年 本科,“平台好，领导好，待遇好”,移动互联网 信息安全 移动端 前端开发 Web前端 Vue ,[岳麓区]
极果生态,前端开发工程师,13k-18k,"移动互联网,消费生活 不需要融资 150-500人",经验5-10年 本科,“企业是标杆企业，机会多，工资高”,前端开发 Web前端 ,[银盆岭]
中科云谷,前端开发工程师,10k-15k・15薪,"人工智能,物联网 不需要融资 150-500人",经验1-3年 本科,“福利待遇好、发展前景好、团队nice”,移动端 前端开发 Web前端 ,[岳麓区]
腾讯,web前端开发工程师,15k-24k,社交 上市公司 2000人以上,经验3-5年 本科,“来就对啦”,Node.js TypeScript Javascript ES6 ,[岳麓区]
宁乡市柠海工作室,前端开发工程师,4k-8k,广告营销 未融资 少于15人,经验3-5年 不限,“1.技术驱动，移动广告，丰厚的盈利”,广告营销 Web前端 Vue 前端开发 ,[岳麓区]
考试云,web前端开发工程师,7k-12k・13薪,软件开发 不需要融资 15-50人,经验3-5年 大专,“五险一金、年终奖/双薪、餐补、带薪年假、双休等”,教育 企业服务 前端开发 Web前端 jQuery HTML5 ,[岳麓区]
鹤腾信息科技,前端开发工程师,6k-10k,"移动互联网,电商 未融资 少于15人",经验3-5年 大专,"“五险一金,年底双薪,双休,年假”",HTML Javascript Web前端 ,[麓谷]
腾云悦智,前端架构师,15k-25k,"企业服务,信息安全 不需要融资 500-2000人",经验5-10年 本科,“五险一金、周末双休、生日礼金”,Vue Node.js Angular React ,[岳麓区]
信小租,javascript/前端工程师,8k-12k,"电商,消费生活 未融资 少于15人",经验3-5年 大专,“发展空间大，餐补，高额绩效奖金”,移动互联网 移动端 前端开发 HTML5 ,[东屯渡]
上海脉多信息技术有限公司,前端开发工程师,10k-20k,"硬件,软件开发 D轮及以上 50-150人",经验1-3年 本科,“准上市公司”,前端开发 HTML5 Angularjs Web前端 ,[新开铺]
数魔,前端工程师,9k-13k,"电商,数据服务 天使轮 50-150人",经验3-5年 本科,"“双休,五险一金,完善的福利和晋升体系。”",移动互联网 云计算 Javascript HTML 前端开发 CSS ,[麓谷]
朗慧科技,前端开发工程师,6k-12k,"移动互联网,企业服务 未融资 15-50人",经验3-5年 大专,“晋升加薪 周末双休 五险一金 沟通无阻”,地图 大数据 移动端 前端开发 Vue ExtJS ,[岳麓区]
威胜集团,前端开发工程师,7k-8k,"硬件,其他 不需要融资 2000人以上",经验3-5年 本科,“行业领先技术，未来发展可期！”,Java ,[麓谷]
爻象信息,前端开发工程师,8k-15k,"企业服务,数据服务 未融资 少于15人",经验3-5年 本科,"“严格规范的代码review,促使你快速的提升;”",企业服务 前端开发 ,[岳麓区]
奇安信集团,前端开发工程师,18k-35k,信息安全 上市公司 2000人以上,经验3-5年 本科,“核心技术部门”,信息安全 前端开发 HTML HTML5 Node.js ,[岳麓区]
湖南视拓信息,前端开发工程师,8k-15k,"移动互联网,企业服务 不需要融资 150-500人",经验3-5年 本科,“五险一金，项目奖金，年终奖”,企业服务 前端开发 Vue Web前端 ,[劳动西路]
腾讯,前端开发工程师,15k-25k,社交 上市公司 2000人以上,经验3-5年 本科,“q”,前端开发 HTML HTML5 Javascript ,[岳麓区]
深圳航天工业技术研究院,前端工程师,7k-14k,其他 不需要融资 50-150人,经验3-5年 本科,“团队大咖多，发展空间大，薪酬富有竞争力”,前端开发 Javascript Web前端 ,[伍家岭]
腾云悦智,前端工程师,10k-15k,"企业服务,信息安全 不需要融资 500-2000人",经验3-5年 本科,“腾讯云华南区域技术支撑中心”,前端开发 Vue HTML HTML5 ,[岳麓区]
灵控智能,前端工程师,6k-12k,"企业服务,移动互联网 未融资 15-50人",经验1-3年 大专,“发展前景好”,前端开发 Node.js ,[雨花区政府]
赛维软件,前端开发工程师,8k-15k,"电商,物联网 不需要融资 50-150人",经验3-5年 本科,“待遇优厚、全新项目，给你施展抱负的平台。”,电商 直播 HTML5 Javascript CSS 前端开发 ,[望岳]
蜜獾信息,React Native前端工程师（SB0402),10k-15k,移动互联网 不需要融资 150-500人,经验3-5年 本科,“餐补交补，五险一金，带薪年假”,React native ,[岳麓区]
长沙富格伦信息科技有限公司,前端工程师,10k-20k,"移动互联网,医疗丨健康 A轮 15-50人",经验3-5年 本科,“高弹性薪酬”,前端开发 HTML CSS React native ,[麓谷]
心源科技,前端开发工程师,9k-15k,"移动互联网,电商 天使轮 15-50人",经验3-5年 大专,“五险一金，双休”,新零售 ,[天心区]
普菲特,前端开发工程师,10k-16k・13薪,"企业服务,数据服务 上市公司 50-150人",经验3-5年 本科,“发展前景，待遇”,Vue HTML5 前端开发 CSS ,[宁乡县]
基裕文化,前端工程师,9k-13k,"旅游,软件开发 未融资 15-50人",经验5-10年 大专,“待遇好谈”,大数据 旅游 CSS Vue HTML ,[岳麓区]
乔伊波伊,前端开发工程师,10k-15k,"电商,旅游 不需要融资 15-50人",经验3-5年 本科,“发展前景大，工作氛围好，老大技术牛”,旅游 移动互联网 Vue 前端开发 jQuery ,[岳麓区]
湖南盖诺贸易有限公司,前端开发工程师,8k-12k,"电商,移动互联网 不需要融资 50-150人",经验1-3年 大专,“提供食宿，周末双休”,CSS 前端开发 Javascript Web前端 ,[高桥]
力光信息,前端开发工程师,5k-10k,"数据服务,软件开发 不需要融资 15-50人",经验1-3年 本科,“企业级图形共享应用平台”,大数据 地图 Vue React CSS3 webGL ,[雨花区]
致佳网络,前端开发工程师,8k-16k,"软件开发,其他 未融资 50-150人",经验不限 不限,“五险一金、餐补、交通补、通信补、带薪年假”,React Node.js ,[岳麓区]
畅远技术,前端开发工程师,6k-8k,"电商,硬件 未融资 15-50人",经验3-5年 大专,“周末双休、五险一金、年终奖金、年度体检、旅游”,前端开发 Web前端 Vue jQuery ,[麓谷]
红网,前端工程师,6k-12k,"移动互联网,电商 上市公司 500-2000人",经验3-5年 本科,"“五险一金,节假福利,带薪年假,交通补贴”",移动互联网 HTML Angularjs Web前端 ,[韶山南路]
云畅科技,前端开发工程师,8k-15k,"消费生活,企业服务 不需要融资 50-150人",经验3-5年 本科,“七险一金 期权激励”,前端开发 Javascript HTML5 ,[雨花区]
谋谋科技,前端开发工程师,10k-15k,移动互联网 未融资 50-150人,经验3-5年 本科,“薪酬待遇好”,前端开发 Web前端 ,[芙蓉区]
舜网,前端开发工程师,5k-8k,软件开发 未融资 少于15人,经验1-3年 大专,“vue”,Vue Javascript HTML CSS ,[岳麓区]
食创,前端开发工程师,6k-12k,企业服务 未融资 150-500人,经验1-3年 大专,“五险一金 餐补 通讯补助 带薪年假”,移动互联网 ,[岳麓区]
三隆通区块链,前端开发工程师,7k-10k,区块链、社交 未融资 15-50人,经验1-3年 本科,“加班少 工作轻松 双休 包中餐”,Javascript CSS HTML5 移动端 ,[岳麓区]
湖南云商世纪网络信息科技有限公司,前端开发工程师,7k-14k,移动互联网 未融资 15-50人,经验1-3年 不限,“单双休”,移动互联网 前端开发 移动端 ,[圭塘]
云之翼,前端开发工程师,8k-13k,"数据服务,企业服务 不需要融资 50-150人",经验3-5年 大专,“专业培训 岗位晋升”,前端开发 HTML5 Javascript CSS ,[三一大道]
大汉无忧智慧,前端开发工程师,10k-15k,物联网、人工智能 未融资 50-150人,经验3-5年 本科,“六险一金，提供住宿，各类补贴。”,通信/网络设备 ,[望城区]
湖南靠谱科技股份有限公司,前端开发工程师,7k-12k,"移动互联网,电商 B轮 150-500人",经验3-5年 大专,"“年终奖,包中餐,大小休,6险”",移动端 Javascript Angularjs ,[新开铺]
道业科技,前端开发工程师,4k-7k,移动互联网 未融资 15-50人,经验1-3年 本科,“双休”,前端开发 Vue CSS Web前端 ,[新开铺]
蓝天白云清洁服务,前端开发工程师,8k-12k,电商 不需要融资 15-50人,经验3-5年 本科,“公司发展前景良好”,HTML5 Javascript Vue Angularjs ,[银盆岭]
长沙可生太,前端开发工程师,12k-18k,电商 A轮 15-50人,经验3-5年 本科,“公司发展前景好   待遇优厚  福利多多”,电商 社交 ,[天心区]
蜜平台,前端开发工程师,6k-10k,"金融,移动互联网 A轮 50-150人",经验3-5年 大专,“五险一金、周末双休、全勤奖”,Vue Web前端 Node.js React native ,[湘江中路]
天河灵控,前端开发工程师,4k-8k,"移动互联网,数据服务 未融资 15-50人",经验不限 不限,“晋升空间大”,前端开发 React native ,[雨花亭]
湖南鹏辰星旅,前端工程师,10k-15k,"移动互联网,社交 A轮 50-150人",经验5-10年 大专,“绩效奖金 定期体检 五险”,Vue HTML5 Javascript React native ,[长沙县]
智信信息,前端开发工程师,7k-12k,"移动互联网,企业服务 不需要融资 50-150人",经验3-5年 本科,"“六险一金,双休13薪,节假日福利”",HTML HTML5 Javascript Web前端 ,[岳麓区]
凌波技术,前端工程师,7k-9k,"人工智能,物联网 A轮 15-50人",经验1-3年 大专,“五险，周末双休”,大数据 其他 ,[雨花区]
融宸佳品建筑装饰工程,前端开发工程师,15k-22k,其他、电商 未融资 50-150人,经验3-5年 本科,“五险一金，年终奖，平台大”,电商 其他 ,[长沙县]
皮皮瑞,前端开发工程师,7k-11k,软件开发 未融资 少于15人,经验3-5年 大专,“五险一金”,React native HTML 前端开发 ,[五里牌]
聚之唯,前端开发工程师,4k-8k,软件开发、企业服务 天使轮 少于15人,经验1-3年 大专,“每月团队活动，年中旅游，工龄工资，季度奖”,移动互联网 企业服务 前端开发 Javascript Web前端 Vue ,[岳麓区]
宝兰德软件,高级前端开发工程师,15k-25k,企业服务 上市公司 150-500人,经验5-10年 大专,“上市公司 发展空间大 五险一金 带薪年假”,移动互联网 Web前端 Vue Javascript webGL ,[岳麓区]
中国软件,web前端开发工程师,12k-18k・13薪,软件开发 上市公司 150-500人,经验3-5年 本科,“央企上市公司 极具竞争力的薪酬福利”,Web前端 ,[岳麓区]
